{
  "fields": {
    "PH_NAME_CN_SURNAME": "王",
    "PH_NAME_CN_GIVEN": "小明",
    "PH_NAME_EN": "Ming Wang",
    "PH_TITLE": "產品經理",
    "PH_PHONE_EXT": "#395",
    "PH_PHONE_MOBILE": "+886-900-000-000",
    "PH_EMAIL": "mingwang@neuin.com",
    "PH_COMPANY": "中子創新有限公司"
  },
  "template_type": "zhongzi-bvi",
  "company": "bvi",
  "dest_path": "/Users/test/Documents/名片/中子/王小明_Ming Wang/20260612-王小明_Ming Wang.ai"
}
